Book Id,Title,Author,Author l-f,Additional Authors,ISBN,ISBN13,My Rating,Average Rating,Publisher,Binding,Number of Pages,Year Published,Original Publication Year,Date Read,Date Added,Bookshelves,Bookshelves with positions,Exclusive Shelf,My Review,Spoiler,Private Notes,Read Count,Recommended For,Recommended By,Owned Copies,Original Purchase Date,Original Purchase Location,Condition,Condition Description,BCID
49127465,The Mutant Project: Inside the Global Race to Genetically Modify Humans,Eben Kirksey,"Kirksey, Eben",,"=""1250265355""","=""9781250265357""",0,3.87,St. Martin's Press,Hardcover,304,2020,2020,,2020/11/25,to-read,to-read (#861),to-read,,,,0,,,0,,,,,
723476,Everyday Zen: Love and Work,Charlotte Joko Beck,"Beck, Charlotte Joko",Steve       Smith,"=""0061285897""","=""9780061285899""",0,4.10,HarperOne,Paperback,240,2007,1989,,2020/11/25,to-read,to-read (#860),to-read,,,,0,,,0,,,,,
28930640,The Ideal Team Player: How to Recognize and Cultivate The Three Essential Virtues,Patrick Lencioni,"Lencioni, Patrick",,"=""""","=""""",0,4.09,Jossey-Bass,Kindle Edition,226,2016,2016,,2020/11/25,to-read,to-read (#859),to-read,,,,0,,,0,,,,,
39093017,"Personality Hacker: Harness the Power of Your Personality Type to Transform Your Work, Relationships, and Life",Joel Mark Witt,"Witt, Joel Mark",Antonia Dodge,"=""""","=""""",4,4.24,Ulysses Press,Kindle Edition,448,2018,2018,2020/11/24,2020/11/14,"2020, academic, general-knowledge, psychology, self-help","2020 (#89), academic (#2), general-knowledge (#25), psychology (#3), self-help (#11)",read,"<br/><br/>A personality type, as I understand it, is like a kind of abstract brain wiring. Similar to how there can only be certain geometric formations of crystals in 3D space, personality types dictate possible structures in which predefined cognitive functions get organised hierarchically resulting in a manifestation of a distinct personality type in ones character. This book does a great job at describing the different cognitive functions that make up personality types and it can be used as a great reference material.<br/><br/>However, there is an obvious problem with the goal of nailing ones personality onto a type. Putting the correctness and legitimacy of the types aside, you proceed on the assumption that you have true self-knowledge which allows you to reflect upon your personality such that it can be identified as a type via self-assessed questionaries. Also, I am skeptical with the idea of personality types in the first place.  What would be the role of culture? Religion? Socio-economic background etc?",,,1,,,0,,,,,
12951631,Breaking The Habit of Being Yourself: How to Lose Your Mind and Create a New One,Joe Dispenza,"Dispenza, Joe",,"=""1401938086""","=""9781401938086""",0,4.13,Hay House,Hardcover,329,2012,2012,,2020/11/22,to-read,to-read (#858),to-read,,,,0,,,0,,,,,
181206,The 80/20 Principle: The Secret to Achieving More with Less,Richard Koch,"Koch, Richard",,"=""0385491743""","=""9780385491747""",0,4.00,Crown Business,Paperback,288,1999,1997,,2020/11/22,currently-reading,currently-reading (#2),currently-reading,,,,1,,,0,,,,,
252465,Pain Free: A Revolutionary Method for Stopping Chronic Pain,Pete Egoscue,"Egoscue, Pete",Roger Gittines,"=""0553379887""","=""9780553379884""",0,4.15,Bantam Books,Paperback,296,2000,2009,,2020/11/20,to-read,to-read (#857),to-read,,,,0,,,0,,,,,
10210,Jane Eyre,Charlotte Brontë,"Brontë, Charlotte","Michael Mason, M. Von Borch","=""0142437204""","=""9780142437209""",0,4.14,Penguin,Paperback,532,2003,1847,,2020/11/20,to-read,to-read (#856),to-read,,,,0,,,0,,,,,
153747,"Moby-Dick or, the Whale",Herman Melville,"Melville, Herman","Andrew Delbanco, Tom Quirk, William Hootkins, Rockwell Kent","=""0142437247""","=""9780142437247""",0,3.53,Penguin Classics ,Paperback,654,2003,1851,,2020/11/20,to-read,to-read (#855),to-read,,,,0,,,0,,,,,
7126,The Count of Monte Cristo,Alexandre Dumas,"Dumas, Alexandre",Robin Buss,"=""0140449264""","=""9780140449266""",0,4.28,Penguin Classics,Paperback,1276,2003,1844,,2020/11/20,to-read,to-read (#853),to-read,,,,0,,,0,,,,,
1953,A Tale of Two Cities,Charles Dickens,"Dickens, Charles","Richard Maxwell, نوشین ابراهیمی","=""0141439602""","=""9780141439600""",0,3.86,Penguin Books,Paperback,489,2003,1859,,2020/11/20,to-read,to-read (#854),to-read,,,,0,,,0,,,,,
3836,Don Quixote,Miguel de Cervantes Saavedra,"Saavedra, Miguel de Cervantes","Roberto González Echevarría, John Rutherford, Cesco Vian, Tobias Smollett, Paola Cozzi","=""""","=""""",0,3.89,Penguin Books,Paperback,1023,2003,1605,,2020/11/20,to-read,to-read (#852),to-read,,,,0,,,0,,,,,
152,Anna Karenina,Leo Tolstoy,"Tolstoy, Leo","David Magarshack, Priscilla Meyer","=""0451528611""","=""9780451528612""",0,4.07,Signet,Mass Market Paperback,960,2002,1878,,2020/11/20,to-read,to-read (#851),to-read,,,,0,,,0,,,,,
24280,Les Misérables,Victor Hugo,"Hugo, Victor","Norman MacAfee, Lee Fahnestock, Isabel Florence Hapgood","=""""","=""""",0,4.19,Penguin,Mass Market Paperback,1463,1987,1862,,2020/11/20,to-read,to-read (#850),to-read,,,,0,,,0,,,,,
48889983,Calling Bullshit: The Art of Skepticism in a Data-Driven World,Carl T. Bergstrom,"Bergstrom, Carl T.",Jevin West,"=""0525509186""","=""9780525509189""",0,4.15,Random House,Hardcover,336,2020,2020,,2020/11/19,to-read,to-read (#849),to-read,,,,0,,,0,,,,,
51942513,Think Like a Monk: Train Your Mind for Peace and Purpose Every Day,Jay Shetty,"Shetty, Jay",,"=""1982134488""","=""9781982134488""",5,4.23,Simon & Schuster,Hardcover,328,2020,2020,2020/11/18,2020/11/03,"2020, i-know-nothing, would-recommend","2020 (#88), i-know-nothing (#37), would-recommend (#49)",read,"I came across Jay Shetty during his interview at <a href=""https://www.youtube.com/watch?v=5Pmu69rdMuw"">The School of Greatness Podcast</a>. I was amazed by the snippets of wisdom he brought to the table, and so I decided to read his book.<br/><br/>The book is about why Jay decided to become a monk, how he became one, what he learnt during the process and why he left monkhood. <br/><br/>In the beginning, I had a bit of suspicion in my heart. I found it difficult to get past the feeling that the author was just signaling his cool spiritual experience to the rest of us and our monkey-minds. <br/><br/>The paragraphs were simple, so simple in fact that it made feel as though I was scrolling on Instagram. But as I read on, I started to develop trust for the author and through that process I learnt a few things. <br/><br/>Why should wisdom be presented in a complex way? Why not simplify it and make it available to more people? I think that's what Jay did in this book.<br/><br/>I'm glad I didn't give up reading.<br/><br/><br/><blockquote><br/><i>Judgement creates an illusion: that if you see well enough to judge, then you must be better, that if someone else is failing, then you must be moving forward.</i><br/></blockquote>",,,1,,,0,,,,,
51079278,The Next Great Migration: The Beauty and Terror of Life on the Move,Sonia Shah,"Shah, Sonia",,"=""1635571979""","=""9781635571974""",0,3.93,Bloomsbury Publishing,Hardcover,400,2020,2020,,2020/11/14,to-read,to-read (#848),to-read,,,,0,,,0,,,,,
233389,The Lives of the Artists,Giorgio Vasari,"Vasari, Giorgio","Julia Conway Bondanella, Peter Bondanella","=""019283410X""","=""9780192834102""",0,3.77,Oxford University Press,Paperback,616,1998,1550,,2020/11/14,to-read,to-read (#847),to-read,,,,0,,,0,,,,,
2784,Ways of Seeing,John Berger,"Berger, John",,"=""0140135154""","=""9780140135152""",0,3.91,Penguin,Paperback,176,1990,1972,,2020/11/14,to-read,to-read (#846),to-read,,,,0,,,0,,,,,
222078,The Story of Art,E.H. Gombrich,"Gombrich, E.H.",,"=""071483355X""","=""9780714833552""",0,3.95,Phaidon Press,Hardcover,688,1995,1950,,2020/11/14,to-read,to-read (#845),to-read,,,,0,,,0,,,,,
29342515,"The Coaching Habit: Say Less, Ask More & Change the Way You Lead Forever",Michael Bungay Stanier,"Stanier, Michael Bungay",,"=""""","=""""",0,4.01,Box of Crayons Press,Kindle Edition,117,2016,2016,,2020/11/14,to-read,to-read (#844),to-read,,,,0,,,0,,,,,
45213809,"You Can Have It All, Just Not at the Same Damn Time",Romi Neustadt,"Neustadt, Romi",,"=""0593085957""","=""9780593085950""",0,3.94,Portfolio,Hardcover,224,2020,,,2020/11/14,to-read,to-read (#843),to-read,,,,0,,,0,,,,,
24611964,"SuperBetter: A Revolutionary Approach to Getting Stronger, Happier, Braver and More Resilient - Powered by the Science of Games",Jane McGonigal,"McGonigal, Jane",,"=""1611764327""","=""9781611764321""",0,3.95,Penguin Audio,Audio CD,15,2015,2015,,2020/11/14,to-read,to-read (#842),to-read,,,,0,,,0,,,,,
48019,The Effective Executive: The Definitive Guide to Getting the Right Things Done,Peter F. Drucker,"Drucker, Peter F.",,"=""0060833459""","=""9780060833459""",0,4.07,Harper Business,Paperback,208,2006,1966,,2020/11/14,to-read,to-read (#841),to-read,,,,0,,,0,,,,,
38400400,The Art of Logic in an Illogical World,Eugenia Cheng,"Cheng, Eugenia",,"=""1541672488""","=""9781541672482""",0,3.50,Basic Books,Hardcover,320,2018,2018,,2020/11/14,to-read,to-read (#840),to-read,,,,0,,,0,,,,,
565631,The Discovery of the Unconscious: The History and Evolution of Dynamic Psychiatry,Henri F. Ellenberger,"Ellenberger, Henri F.",,"=""0465016731""","=""9780465016730""",0,4.45,Basic Books,Paperback,976,1981,1970,,2020/11/13,to-read,to-read (#839),to-read,,,,0,,,0,,,,,
6635,The Enneagram Made Easy: Discover the 9 Types of People,Renee Baron,"Baron, Renee",Elizabeth Wagele,"=""0062510266""","=""9780062510266""",0,3.84,HarperSanFrancisco,Paperback,161,1994,1994,,2020/11/12,to-read,to-read (#837),to-read,,,,0,,,0,,,,,
311053,The Wisdom of the Enneagram: The Complete Guide to Psychological and Spiritual Growth for the Nine Personality Types,Don Richard Riso,"Riso, Don Richard",Russ Hudson,"=""0553378201""","=""9780553378207""",0,4.16,Bantam,Paperback,391,1999,1999,,2020/11/12,to-read,to-read (#838),to-read,,,,0,,,0,,,,,
565806,Psychological Types,C.G. Jung,"Jung, C.G.",,"=""0691018138""","=""9780691018133""",0,4.32,Princeton University Press,Paperback,608,1976,1921,,2020/11/12,to-read,to-read (#836),to-read,,,,0,,,0,,,,,
23500254,"The Power of Vulnerability: Teachings of Authenticity, Connections and Courage",Brené Brown,"Brown, Brené",,"=""""","=""""",0,4.60,Sounds True,Audible Audio,1,2013,2013,,2020/11/11,to-read,to-read (#835),to-read,,,,0,,,0,,,,,
16052272,In Search of Identity,Anwar Sadat,"Sadat, Anwar",,"=""""","=""""",0,3.75,HARPER AND ROW,Hardcover,360,1977,1977,,2020/11/06,"to-read, 2020","to-read (#834), 2020 (#87)",to-read,,,,0,,,0,,,,,
449818,No Boundary: Eastern and Western Approaches to Personal Growth,Ken Wilber,"Wilber, Ken",,"=""1570627436""","=""9781570627439""",0,4.29,Shambhala,Paperback,149,2001,1979,,2020/11/06,to-read,to-read (#833),to-read,,,,0,,,0,,,,,
177175,Grace & Grit: Spirituality & Healing in the Life & Death of Treya Killam Wilber,Ken Wilber,"Wilber, Ken",,"=""1570627428""","=""9781570627422""",0,4.46,Shambhala,Paperback,504,2001,1991,,2020/11/06,to-read,to-read (#832),to-read,,,,0,,,0,,,,,
24611751,"Psycho-Cybernetics, Updated and Expanded",Maxwell Maltz,"Maltz, Maxwell",,"=""0399176136""","=""9780399176135""",3,4.23,TarcherPerigee,Paperback,336,2015,1960,2018/02/23,2017/08/03,,,read,,,,1,,,0,,,,,
34189313,"The 5 Second Rule: Transform Your Life, Work, and Confidence with Everyday Courage",Mel Robbins,"Robbins, Mel",,"=""""","=""""",0,3.88,Savio Republic,Kindle Edition,267,2017,2017,,2020/10/30,to-read,to-read (#831),to-read,,,,0,,,0,,,,,
9628743,"The Social Animal: The Hidden Sources of Love, Character, and Achievement",David  Brooks,"Brooks, David",,"=""140006760X""","=""9781400067602""",5,3.86,Random House,Hardcover,424,2011,2011,2020/10/30,2018/10/08,would-recommend,would-recommend (#4),read,Perfect audiobook for sleep.,,,2,,,0,,,,,
97006,Intuition: Knowing Beyond Logic,Osho,"Osho, Osho",,"=""0312275676""","=""9780312275679""",0,3.96,St. Martin's Griffin,Paperback,208,2001,2001,,2020/10/25,to-read,to-read (#830),to-read,,,,0,,,0,,,,,
96998,The Book of Secrets (Complete),Osho,"Osho, Osho",,"=""0312180586""","=""9780312180584""",0,4.11,St. Martin's Griffin,Paperback,1152,1998,1974,,2020/10/25,to-read,to-read (#829),to-read,,,,0,,,0,,,,,
97015,Freedom: The Courage to Be Yourself,Osho,"Osho, Osho",,"=""0312320701""","=""9780312320706""",0,4.03,St. Martin's Griffin,Paperback,192,2004,2004,,2020/10/25,to-read,to-read (#828),to-read,,,,0,,,0,,,,,
97008,"Love, Freedom, and Aloneness: The Koan of Relationships",Osho,"Osho, Osho",,"=""0312291620""","=""9780312291624""",0,4.08,St. Martin's Griffin,Paperback,244,2002,2001,,2020/10/25,to-read,to-read (#827),to-read,,,,0,,,0,,,,,
1963638,The Untethered Soul: The Journey Beyond Yourself,Michael A. Singer,"Singer, Michael A.",,"=""1572245379""","=""9781572245372""",0,4.21,New Harbinger Publications,Paperback,186,2007,2007,,2020/10/25,to-read,to-read (#825),to-read,,,,0,,,0,,,,,
639864,Autobiography of a Yogi,Paramahansa Yogananda,"Yogananda, Paramahansa",,"=""0876120834""","=""9780876120835""",0,4.22,Self-Realization Fellowship Publishers,Paperback,448,1994,1946,,2020/10/25,to-read,to-read (#824),to-read,,,,0,,,0,,,,,
19501,"Eat, Pray, Love: One Woman's Search for Everything Across Italy, India and Indonesia",Elizabeth Gilbert,"Gilbert, Elizabeth",,"=""0143038419""","=""9780143038412""",0,3.60,Riverhead Books,Paperback,368,2007,2006,,2020/10/25,to-read,to-read (#823),to-read,,,,0,,,0,,,,,
53208181,A Project to Find the Fundamental Theory of Physics,Stephen Wolfram,"Wolfram, Stephen",,"=""1579550355""","=""9781579550356""",0,4.11,Wolfram Media,Hardcover,770,2020,,,2020/10/21,to-read,to-read (#822),to-read,,,,0,,,0,,,,,
238558,A New Kind of Science,Stephen Wolfram,"Wolfram, Stephen",,"=""1579550088""","=""9781579550080""",0,3.61,Wolfram Media,Hardcover,1264,2002,1997,,2020/10/21,to-read,to-read (#821),to-read,,,,0,,,0,,,,,
34017010,The State of Affairs: Rethinking Infidelity,Esther Perel,"Perel, Esther",,"=""0062322605""","=""9780062322609""",0,4.37,Harper,ebook,352,2017,2017,,2020/10/13,to-read,to-read (#819),to-read,,,,0,,,0,,,,,
27485,Mating in Captivity: Reconciling the Erotic and the Domestic,Esther Perel,"Perel, Esther",Martina Pranić,"=""0060753633""","=""9780060753634""",0,4.16,Harper,Hardcover,272,2006,2006,,2020/10/13,to-read,to-read (#818),to-read,,,,0,,,0,,,,,
34507927,"How to Take Smart Notes: One Simple Technique to Boost Writing, Learning and Thinking – for Students, Academics and Nonfiction Book Writers",Sönke Ahrens,"Ahrens, Sönke",,"=""""","=""""",0,4.19,,Kindle Edition,178,2017,2017,,2020/10/09,"2020, currently-reading","2020 (#84), currently-reading (#1)",currently-reading,,,,1,,,0,,,,,
7103545,"The Conscious Parent: Transforming Ourselves, Empowering Our Children",Shefali Tsabary,"Tsabary, Shefali",,"=""1897238452""","=""9781897238455""",0,4.29,Namaste Publishing,Paperback,300,2010,2010,,2020/10/11,to-read,to-read (#817),to-read,,,,0,,,0,,,,,
55004129,"A Radical Awakening: Turn Pain into Power, Embrace Your Truth, Live Free",Shefali Tsabary,"Tsabary, Shefali",,"=""0062985892""","=""9780062985897""",0,4.18,HarperOne,Hardcover,384,2021,,,2020/10/11,"to-read, 2020","to-read (#816), 2020 (#86)",to-read,,,,0,,,0,,,,,
9969571,Ready Player One,Ernest Cline,"Cline, Ernest",,"=""030788743X""","=""9780307887436""",0,4.24,Crown Publishers,Hardcover,374,2011,2011,,2020/10/10,"to-read, 2020","to-read (#815), 2020 (#85)",to-read,,,,0,,,0,,,,,
123698,The Psychedelic Experience: A Manual Based on the Tibetan Book of the Dead,Timothy Leary,"Leary, Timothy","Ralph Metzner, Richard Alpert, Ram Dass","=""0806516526""","=""9780806516523""",0,3.79,Citadel Underground,Paperback,160,2000,1964,,2020/10/07,"to-read, 2020","to-read (#814), 2020 (#83)",to-read,,,,0,,,0,,,,,
40876575,Utopia for Realists: How We Can Build the Ideal World,Rutger Bregman,"Bregman, Rutger",,"=""""","=""""",0,4.24,"Little, Brown and Company",Kindle Edition,262,2017,2014,,2020/10/07,to-read,to-read (#813),to-read,,,,0,,,0,,,,,
22551809,The Road to Character,David  Brooks,"Brooks, David",,"=""081299325X""","=""9780812993257""",0,3.66,Random House,Hardcover,320,2015,2015,,2020/10/05,to-read,to-read (#812),to-read,,,,0,,,0,,,,,
2348604,Freedom Flight,Lanny Bassham,"Bassham, Lanny",,"=""1934324019""","=""9781934324011""",0,4.35,Mental Management Systems LLC,Audiocd,0,2003,2003,,2020/10/05,to-read,to-read (#811),to-read,,,,0,,,0,,,,,
208926,With Winning in Mind: The Mental Management System: An Olympic Champion's Success System,Lanny Bassham,"Bassham, Lanny",,"=""1885221479""","=""9781885221476""",0,4.40,Bookpartners,Paperback,162,1996,1996,,2020/10/05,to-read,to-read (#810),to-read,,,,0,,,0,,,,,
13235689,How Music Works,David Byrne,"Byrne, David",,"=""1936365537""","=""9781936365531""",0,3.98,McSweeney's,Hardcover,345,2012,2012,,2020/10/03,"to-read, 2020","to-read (#809), 2020 (#82)",to-read,,,,0,,,0,,,,,
174892,The Confessions of an English Opium-Eater,Thomas De Quincey,"Quincey, Thomas De",,"=""1420927078""","=""9781420927078""",0,3.28,Digireads.com,Paperback,88,2006,1821,,2020/10/03,to-read,to-read (#808),to-read,,,,0,,,0,,,,,
15997,Paradise Lost,John Milton,"Milton, John","Anton Lesser, John      Leonard, Antônio José Lima Leitão","=""0140424393""","=""9780140424393""",0,3.82,Penguin Classics,Paperback,453,2003,1667,,2020/10/03,to-read,to-read (#807),to-read,,,,0,,,0,,,,,
56495,The Purpose Driven Life: What on Earth Am I Here for?,Rick Warren,"Warren, Rick",,"=""0310276993""","=""9780310276999""",0,3.95,Zondervan Publishing Company,Paperback,334,2007,2002,,2020/10/03,to-read,to-read (#806),to-read,,,,0,,,0,,,,,
127227,The Human Condition,Hannah Arendt,"Arendt, Hannah",Margaret Canovan,"=""0226025985""","=""9780226025988""",0,4.22,University of Chicago Press,Paperback,349,1998,1958,,2020/10/03,to-read,to-read (#805),to-read,,,,0,,,0,,,,,
396931,The Origins of Totalitarianism,Hannah Arendt,"Arendt, Hannah",,"=""""","=""""",0,4.30,Harcourt Brace Jovanovich,Paperback,527,1973,1951,,2020/10/03,to-read,to-read (#804),to-read,,,,0,,,0,,,,,
52090,Eichmann in Jerusalem: A Report on the Banality of Evil,Hannah Arendt,"Arendt, Hannah",Amos Elon,"=""""","=""""",0,4.21,Penguin Classics,Paperback,312,2006,1963,,2020/10/03,to-read,to-read (#803),to-read,,,,0,,,0,,,,,
50929327,The Map of Consciousness Explained: A Proven Energy Scale to Actualize Your Ultimate Potential,David R. Hawkins,"Hawkins, David R.",,"=""1401959644""","=""9781401959647""",0,4.39,Hay House,Paperback,400,2020,2019,,2020/10/03,to-read,to-read (#801),to-read,,,,0,,,0,,,,,
7707915,Set Theory and the Continuum Problem,Raymond M. Smullyan,"Smullyan, Raymond M.",Melvin Fitting,"=""0486474844""","=""9780486474847""",0,4.05,Dover Publications,Paperback,336,2010,1996,,2020/10/02,to-read,to-read (#800),to-read,,,,0,,,0,,,,,
5752,The Blank Slate: The Modern Denial of Human Nature,Steven Pinker,"Pinker, Steven",,"=""0142003344""","=""9780142003343""",0,4.08,Penguin Books,Paperback,528,2003,2002,,2020/10/02,to-read,to-read (#799),to-read,,,,0,,,0,,,,,
891600,Caffeine Blues: Wake Up to the Hidden Dangers of America's #1 Drug,Stephen Cherniske,"Cherniske, Stephen",,"=""0446673919""","=""9780446673914""",0,4.02,Grand Central Publishing,Paperback,464,1998,1998,,2020/09/28,to-read,to-read (#798),to-read,,,,0,,,0,,,,,
38728977,"The Molecule of More: How a Single Chemical in Your Brain Drives Love, Sex, and Creativity—and Will Determine the Fate of the Human Race",Daniel Z. Lieberman,"Lieberman, Daniel Z.",Michael E. Long,"=""1946885118""","=""9781946885111""",0,4.18,BenBella Books,Hardcover,240,2018,2018,,2020/09/26,to-read,to-read (#797),to-read,,,,0,,,0,,,,,
1499313,Semantic Information Processing,Marvin Minsky,"Minsky, Marvin",,"=""0262130440""","=""9780262130448""",0,3.85,MIT Press,Hardcover,440,1969,1969,,2020/09/25,to-read,to-read (#796),to-read,,,,0,,,0,,,,,
40410825,Islamic Creed,Ibn Taymiyyah,"Taymiyyah, Ibn",Al Reshah,"=""""","=""""",0,4.88,Al Reshah,Kindle Edition,59,2018,1328,,2020/09/25,to-read,to-read (#795),to-read,,,,0,,,0,,,,,
48510196,The Principle of Patience,Ibn Taymiyyah,"Taymiyyah, Ibn","Abu Fatimah Azhar Majothi, Umm 'Abdillah F. Khanom","=""""","=""""",0,4.67,Darul Imam Muslim,Paperback,32,2015,1328,,2020/09/25,to-read,to-read (#794),to-read,,,,0,,,0,,,,,
39702252,Aqeedah Wasitiyyah,Ibn Taymiyyah,"Taymiyyah, Ibn",,"=""1976211522""","=""9781976211522""",0,4.50,CreateSpace Independent Publishing Platform,Paperback,42,2017,,,2020/09/25,to-read,to-read (#793),to-read,,,,0,,,0,,,,,
61539,The Structure of Scientific Revolutions,Thomas S. Kuhn,"Kuhn, Thomas S.",,"=""0226458083""","=""9780226458083""",0,4.03,University of Chicago Press,Paperback,226,1996,1962,,2019/09/15,"to-read, fall-2019, 2020","to-read (#338), fall-2019 (#35), 2020 (#81)",to-read,,,,0,,,0,,,,,
202695,Genesis and Development of a Scientific Fact,Ludwik Fleck,"Fleck, Ludwik","Robert K. Merton, Thaddeus J. Trenn, Frederick Bradley, Thomas S. Kuhn","=""0226253252""","=""9780226253251""",0,4.24,University of Chicago Press,Paperback,222,1981,1935,,2020/09/25,to-read,to-read (#792),to-read,,,,0,,,0,,,,,
745236,The Copernican Revolution: Planetary Astronomy in the Development of Western Thought,Thomas S. Kuhn,"Kuhn, Thomas S.",,"=""0674171039""","=""9780674171039""",0,4.12,Harvard University Press,Paperback,320,1992,1957,,2020/09/25,to-read,to-read (#791),to-read,,,,0,,,0,,,,,
10534,The Art of War,Sun Tzu,"Tzu, Sun","Thomas Cleary, Pulat Otkan","=""""","=""""",3,3.97,Harper Press,Paperback,273,2005,-500,,2016/10/03,2020,2020 (#80),read,,,,1,,,0,,,,,
78428,Your Money or Your Life,Vicki Robin,"Robin, Vicki",Joe Dominguez,"=""0140286780""","=""9780140286786""",0,4.01,Penguin Books,Paperback,400,1999,1992,,2019/12/09,"to-read, money, 2020","to-read (#454), money (#1), 2020 (#79)",to-read,,,,0,,,0,,,,,
336868,Mastering Jujitsu,Renzo Gracie,"Gracie, Renzo",John Danaher,"=""0736044043""","=""9780736044042""",0,4.13,Human Kinetics Publishers,Paperback,248,2003,2003,,2020/09/24,to-read,to-read (#790),to-read,,,,0,,,0,,,,,
336867,Brazilian Jiu-Jitsu: Theory and Technique,Renzo Gracie,"Gracie, Renzo","Royler Gracie, Kid Peligro, John Danaher","=""1931229082""","=""9781931229081""",0,4.16,Invisible Cities Press LLC,Paperback,304,2001,2001,,2020/09/24,to-read,to-read (#789),to-read,,,,0,,,0,,,,,
18995451,Kettlebell - Simple & Sinister,Pavel Tsatsouline,"Tsatsouline, Pavel",,"=""""","=""""",0,4.35,,Kindle Edition,172,2013,2013,,2020/09/24,to-read,to-read (#788),to-read,,,,0,,,0,,,,,
18053000,The End of Dieting: How to Live for Life,Joel Fuhrman,"Fuhrman, Joel",,"=""0062249347""","=""9780062249340""",0,3.97,HarperOne,ebook,368,2014,2013,,2020/09/24,to-read,to-read (#787),to-read,,,,0,,,0,,,,,
602300,Power to the People!: Russian Strength Training Secrets for Every American,Pavel Tsatsouline,"Tsatsouline, Pavel",,"=""0938045199""","=""9780938045199""",0,4.10,Dragon Door Publications,Paperback,116,2000,1999,,2020/09/24,to-read,to-read (#786),to-read,,,,0,,,0,,,,,
4618544,The New Power Program: Protocols for Maximum Strength,Michael Colgan,"Colgan, Michael",,"=""1896817009""","=""9781896817002""",0,3.91,Apple Publishing Company,Paperback,374,2001,2001,,2020/09/24,to-read,to-read (#785),to-read,,,,0,,,0,,,,,
8651755,Building The Gymnastic Body: The Science of Gymnastics Strength Training,Christopher Sommer,"Sommer, Christopher",,"=""0982125305""","=""9780982125304""",0,3.86,Olympic Bodies LLC,Paperback,195,2008,2008,,2020/09/24,to-read,to-read (#784),to-read,,,,0,,,0,,,,,
13594266,"Becoming a Supple Leopard: The Ultimate Guide to Resolving Pain, Preventing Injury, and Optimizing Athletic Performance",Kelly Starrett,"Starrett, Kelly",Glen Cordoza,"=""1936608588""","=""9781936608584""",0,4.39,Victory Belt Publishing,Hardcover,400,2013,2013,,2020/09/24,to-read,to-read (#783),to-read,,,,0,,,0,,,,,
13588189,Power Speed ENDURANCE: A Skill-Based Approach to Endurance Training,Brian Mackenzie,"Mackenzie, Brian",Glen Cordoza,"=""1936608618""","=""9781936608614""",0,3.92,Victory Belt Publishing,Paperback,416,2012,2011,,2020/09/24,to-read,to-read (#781),to-read,,,,0,,,0,,,,,
12110336,The Toughest Man Who Ever Lived,Nori Bunasawa,"Bunasawa, Nori",John Murray,"=""""","=""""",0,4.26,,Kindle Edition,370,,2007,,2020/09/24,to-read,to-read (#782),to-read,,,,0,,,0,,,,,
189448,Periodization Training for Sports,Tudor O. Bompa,"Bompa, Tudor O.",Michael C. Carrera,"=""0736055592""","=""9780736055598""",0,4.23,Human Kinetics Publishers,Paperback,272,2005,1999,,2020/09/24,to-read,to-read (#780),to-read,,,,0,,,0,,,,,
13633337,Behind the Shock Machine: The Untold Story of the Notorious Milgram Psychology Experiments,Gina Perry,"Perry, Gina",,"=""1921844558""","=""9781921844553""",0,3.77,Scribe Publications,Paperback,432,2012,2012,,2020/09/23,to-read,to-read (#779),to-read,,,,0,,,0,,,,,
52365259,A People's Guide to Capitalism: An Introduction to Marxist Economics,Hadas Thier,"Thier, Hadas",,"=""""","=""9781642592511""",0,4.33,Haymarket Books,Hardcover,300,2020,2018,,2020/09/22,to-read,to-read (#778),to-read,,,,0,,,0,,,,,
123471,I Am a Strange Loop,Douglas R. Hofstadter,"Hofstadter, Douglas R.",,"=""0465030785""","=""9780465030781""",0,3.95,Basic Books (AZ),Hardcover,412,2007,2007,,2020/09/21,"to-read, maybe-someday","to-read (#777), maybe-someday (#1)",to-read,,,,0,,,0,,,,,
62555,On Human Nature,Edward O. Wilson,"Wilson, Edward O.",,"=""0674016386""","=""9780674016385""",0,4.15,Harvard University Press ,Paperback,288,2004,1978,,2020/09/20,to-read,to-read (#776),to-read,,,,0,,,0,,,,,
55981,Consilience: The Unity of Knowledge,Edward O. Wilson,"Wilson, Edward O.",,"=""067976867X""","=""9780679768678""",0,3.99,Vintage,Paperback,368,1999,1998,,2020/09/20,to-read,to-read (#775),to-read,,,,0,,,0,,,,,
183818,The Insect Societies,Edward O. Wilson,"Wilson, Edward O.",,"=""0674454952""","=""9780674454958""",0,4.69,Belknap Press,Paperback,548,1971,1971,,2020/09/20,to-read,to-read (#774),to-read,,,,0,,,0,,,,,
